<?xml version='1.0' encoding='utf-8'?>
<exercise xmlns:xsi="http://www.w3.org/2001/XMLSchema-instance" schemaversion="1" xsi:noNamespaceSchemaLocation="exercise.xsd">
  <creator>jemand</creator>
  <number>1</number>
  <description>eine langweilige Aufgabe</description>
  <modified>2002-05-30T09:30:10</modified>
  <tex_preamble>\usepackage[utf8]{inputenc}</tex_preamble>
  <tex_exercise lang="DE">$x$</tex_exercise>
  <tex_solution lang="DE">$y$</tex_solution>
  <tex_solution lang="EN">$z$รถ</tex_solution>
  <tag>aabc</tag>
  <tag>Revised Simplex</tag>
</exercise>
